Title,Date and Time,Image Source,Story
"<h1 class=""article-title"">Congress On Adani: ईडी दफ्तर में अडानी मामले की शिकायत करने से रोका गया तो मल्लिकार्जुन खरगे ने कर दिया ईमेल</h1>","By: एबीपी न्यूज, एजेंसी | Updated at : 15 Mar 2023 06:26 PM (IST)  ",https://feeds.abplive.com/onecms/images/uploaded-images/2023/03/15/832f3adfb80d6bbf41a77e98f23f34131678883029270330_original.jpg?impolicy=abp_cdn&imwidth=720,"['By: एबीपी न्यूज, एजेंसी | Updated at : 15 Mar 2023 06:26 PM (IST)  ', '\n', 'अडानी समूह के खिलाफ मार्च में कांग्रेस अध्यक्ष मल्लिकार्जुन खरगे  ( Image Source : PTI )', 'Mallikarjun Kharge Email To ED Over Adani: कांग्रेस अध्यक्ष मल्लिकार्जुन खरगे ने बुधवार (15 मार्च) को प्रवर्तन निदेशालय (ED) को ईमेल के माध्यम से एक पत्र भेजा, जिसके जरिये अडानी समूह पर लगाए गए धोखाधड़ी के आरोपों पर तत्काल प्रभाव से कार्रवाई करने की मांग की गई है. कथित तौर पर खरगे ने यह ईमेल 16 विपक्षी दलों के नेताओं को प्रवर्तन निदेशालय के कार्यालय में पहुंचकर हाथ से पत्र जमा करने से रोके जाने के बाद किया है.\xa0', 'बुधवार को संसद परिसर से ईडी कार्यालय तक बैरिकेड लगाए गए. रिपोर्ट्स के मुताबिक, नेताओं को ईडी कार्यालय तक पहुंचने से रोकने के लिए पुलिस ने यह कदम उठाया. इस दौरान परिसर के आसपास कथित तौर पर धारा 144 लागू कर दी गई, जो एक जगह चार से ज्यादा लोगों के इकट्ठा होने को प्रतिबंधित करती है.\xa0ईडी मुख्यालय की ओर मार्च निकालने वाले 16 विपक्षी दलों के नेताओं को पुलिस ने विजय चौक पर ही रोक लिया.', ""'ED अपने अधिकार क्षेत्र का त्याग नहीं कर सकती'"", 'ईडी के निदेशक एसके मिश्रा को ईमेल किए गए पत्र में विपक्षी नेताओं ने कहा कि यह संस्था अपने अधिकार क्षेत्र का त्याग नहीं कर सकती और उसे जांच करनी चाहिए. कांग्रेस अध्यक्ष खरगे ने मीडिया से कहा, ‘‘हम अडानी समूह के घोटाले के मामले में ज्ञापन देने के लिए ईडी निदेशक से मिलने जा रहे थे, लेकिन सरकार ने हमें रोक लिया और विजय चौक तक भी जाने नहीं दिया. उन्होंने दावा किया, ‘‘लाखों करोड़ रुपये का घोटाला हुआ है. एलआईसी, स्टेट बैंक और दूसरे कई बैंक बर्बाद हो गए हैं. लोगों के बैंकों में रखे पैसे एक व्यक्ति को दे दिए गए. एक व्यक्ति अचानक से इतना अमीर हो गया. आज इस व्यक्ति की संपत्ति 13 लाख करोड़ रुपये हो गई है.’’', 'उन्होंने कहा, ‘‘इसकी जांच होनी चाहिए कि अडाणी और मोदी जी का रिश्ता क्या है.’’ राष्ट्रीय जनता दल के सांसद मनोज झा ने आरोप लगाया कि यह तानाशाही सरकार है और यह विपक्ष की आवाज को दबाना चाहती है.\xa0', 'जयराम रमेश ने ट्वीट की पत्र की कॉपी', 'कांग्रेस महासचिव जयराम रमेश ने ईडी निदेशक को मेल किया गया पत्र साझा करते हुए ट्वीट किया, ‘‘ईडी को अडानी घोटाले की जांच की मांग का शिकायती पत्र सौंपने जा रहे 16 विपक्षी दलों के नेताओं और सांसदों को आज दोपहर ईडी के कार्यालय तक जाने से रोक दिया गया. यह वह पत्र है, जिसे ईडी को ईमेल किया गया है.’’\xa0', 'ईडी को अडानी घोटाले की जांच की मांग का शिकायती पत्र सौंपने जा रहे 16 विपक्षी दलों के नेताओं और सांसदों को आज दोपहर ईडी के कार्यालय तक जाने से रोक दिया गया।यह वह पत्र है, जिसे ईडी को ईमेल किया गया है। pic.twitter.com/u9XGWOmE2V', '\n\n', 'कांग्रेस के अलावा इन दलों ने किए पत्र पर हस्ताक्षर', 'कांग्रेस समेत कई विपक्षी दलों ने अडानी समूह के खिलाफ तीन पन्नों के इस पत्र में ‘शेल’ कंपनियों और धनशोधन समेत कई आरोप लगाए गए हैं.\xa0कांग्रेस, भारतीय कम्युनिस्ट पार्टी, मार्क्सवादी कम्युनिस्ट पार्टी, जनता दल (यूनाइटेड), शिवसेना (यूबीटी), राष्ट्रीय जनता दल, झारखंड मुक्ति मोर्चा, आम आदमी पार्टी, इंडियन यूनियन मुस्लिम लीग, और कई अन्य दलों के नेताओं ने इस पत्र पर हस्ताक्षर किए हैं.\xa0', 'मार्च पर पहले खरगे के ऑफिस में बनाई गई थी रणनीति', 'विपक्षी दलों के मार्च से पहले, खरगे के संसद भवन परिसर स्थित कार्यालय में विपक्षी दलों के नेताओं ने अडाणी समूह से जुड़े मुद्दे पर अपनी संयुक्त रणनीति में समन्वय के लिए एक बैठक की थी. तृणमूल कांग्रेस विपक्षी दलों के इस मार्च का हिस्सा नहीं थी. उसके सांसदों ने घरेलू रसोई गैस (एलपीजी) की कीमतों में वृद्धि को लेकर संसद भवन परिसर में महात्मा गांधी की प्रतिमा के सामने प्रदर्शन किया.', 'अडानी मामले पर JPC की मांग कर रहा विपक्ष', 'अमेरिकी वित्तीय शोध संस्था ‘हिंडनबर्ग रिसर्च’ की रिपोर्ट आने के बाद से ही अडानी समूह और प्रधानमंत्री नरेंद्र मोदी पर लगातार हमलावर विपक्षी दलों के सदस्यों की मांग है कि इस मुद्दे की जांच के लिए संयुक्त संसदीय समिति (JPC) का गठन किया जाए.\xa0उल्लेखनीय है कि ‘हिंडनबर्ग रिसर्च’ ने अडानी समूह के खिलाफ फर्जी तरीके से लेन-देन और शेयर की कीमतों में हेर-फेर सहित कई आरोप लगाए थे. अडानी समूह ने इन आरोपों को झूठा करार देते हुए कहा था कि उसने सभी कानूनों और प्रावधानों का पालन किया है.', ""यह भी पढ़ें- Rahul Gandhi Remarks: 'राहुल गांधी की संसद सदस्यता खत्म कर दें', बीजेपी सांसद ने स्पीकर को लिखा पत्र"", 'Delhi Excise Policy: दिल्ली सरकार ने 6 महीने के लिए बढ़ाई मौजूदा आबकारी नीति, सीएम केजरीवाल ने दी मंजूरी', 'क्या प्रधानमंत्री नरेंद्र मोदी को मिल सकता है शांति का नोबेल पुरस्कार?', 'Viral Video: टिकट चेकर और महिला यात्री के बीच स्टेशन पर हुई झड़प, वीडियो वायरल हुआ तो रेलवे ने किया सस्पेंड', 'Cheating Case: मुख्यमंत्री जगन मोहन रेड्डी का PA बनकर पूर्व रणजी क्रिकेटर ने कर ली लाखों की ठगी, अब चढ़ा पुलिस के हत्थे', ""Uddhav vs Shinde: 'शिंदे कैंप के विधायकों को उद्धव ठाकरे के कांग्रेस-NCP से गठबंधन पर एतराज था तो...', सुप्रीम कोर्ट की अहम टिप्पणी"", 'IPL\xa02023: ऋषभ पंत से लेकर जसप्रीत बुमराह तक, आगामी सीजन में ये बड़े खिलाड़ी नहीं दिखेंगे मैदान पर', 'सिलिकॉन वैली:  हिंदू-मुसलमान या फिर सिख, कोई भी हो अब हर युवा यहीं जाना चाहता है, जानिए क्यों?', 'Sonu Sood को ऑफर हुए राज्यसभा और डिप्टी सीएम बनने के पद, पॉलिटिक्स जॉइन करने के सवाल पर एक्टर ने किया खुलासा', 'Mobile Tariff: रिलायंस जियो के इस धमाकेदार नए पोस्ट-पेड टैरिफ प्लान ने बढ़ाई एयरटेल-वोडाफोन आइडिया की मुश्किल!', 'SCO Summit: एससीओ समिट के लिए भारत ने पाकिस्तान के रक्षा मंत्री को भेजा न्यौता, अगले महीने दिल्ली में होगी मीटिंग']"
"<h1 class=""article-title"">Delhi Excise Policy: दिल्ली सरकार ने 6 महीने के लिए बढ़ाई मौजूदा आबकारी नीति, सीएम केजरीवाल ने दी मंजूरी</h1>",By: सुशांत शुक्ला | Updated at : 15 Mar 2023 06:23 PM (IST)  ,https://feeds.abplive.com/onecms/images/uploaded-images/2023/03/15/aee0fbfcf8a103982232613f8770e0ea1678880517088607_original.jpg?impolicy=abp_cdn&imwidth=720,"['By: सुशांत शुक्ला | Updated at : 15 Mar 2023 06:23 PM (IST)  ', '\n', 'दिल्ली के सीएम अरविंद केजरीवाल  ( Image Source : PTI File Photo )', 'Delhi Excise Policy Extend: दिल्ली में कथित शराब घोटाले पर जारी हो-हल्ला के बीच मौजूदा पुरानी आबकारी नीति जारी रहेगी. मुख्यमंत्री अरविंद केजरीवाल ने बुधवार (15 मार्च) को वर्तमान आबकारी नीति को 6 महीने के लिए आगे बढ़ाने के प्रस्ताव को मंजूरी दे दी. सीएम केजरीवाल ने इसके साथ ही आबकारी विभाग के अधिकारियों को नई आबकारी नीति पर तेजी से काम करने के निर्देश दिए हैं.\xa0', 'इसके साथ ही दिल्ली सरकार ने आगामी तीन महीनों के लिए 5 ड्राई डे भी घोषित किए हैं. दरअसल, वर्तमान एक्साइज पॉलिसी का समय 31 मार्च को खत्म हो रहा है. जिसे 6 महीने के लिए आगे बढ़ाने का प्रस्ताव आबकारी विभाग की तरफ से दिया गया था. आबकारी मंत्री की तरफ से इसे मंजूरी देने के बाद प्रस्ताव मुख्यमंत्री अरविंद केजरीवाल के पास पहुंचा.\xa0', 'अधिकारियों को दिए ये आदेश', 'सीएम अरविंद केजरीवाल ने बुधवार (15 मार्च) को मंजूर कर दिया है. अब दिल्ली में वर्तमान में चल रही एक्साइज पॉलिसी 30 सितंबर 2023 तक लागू रहेगी. इसके साथ ही सीएम अरविंद केजरीवाल ने आबकारी विभाग को नई एक्साइज पॉलिसी पर तेजी से काम करने के निर्देश दिए हैं. उन्होंने अधिकारियों से डिटेल प्लान तैयार करने को कहा है. जिससे जल्द से जल्द दिल्ली को एक नई आबकारी नीति दी जा सके.', 'ड्राइ-डे की लिस्ट भी घोषित', 'वहीं दिल्ली सरकार ने ड्राई डे की लिस्ट भी घोषित कर दी है. दिल्ली में आगामी तीन महीने में 5 ड्राइ डे रहेंगे. दिल्ली सरकार ने 4 अप्रैल को महावीर जयंती, 7 अप्रैल को गुड फ्राइडे, 22 अप्रैल को ईद उल फितर, 5 मई को बुद्ध पूर्णिमा और 29 जून को ईद उल जुहा पर ड्राई डे घोषित किया है.', 'जेल में बंद हैं सिसोदिया', 'बता दें कि दिल्ली सरकार की ओर से लाई गई आबकारी नीति 2021-22 को वापस ले लिया गया था. साथ ही सरकार ने नई एक्साइज पॉलिसी के तैयार होने तक पुरानी शराब नीति को लागू किया गया था. हालांकि, अभी तक अधिकारियों की तरफ से नई एक्साइज पॉलिसी तैयार नहीं हो पाई है. वहीं शराब घोटाले में केजरीवाल सरकार और आम आदमी पार्टी बुरी तरह घिरी हुई है. मुख्यमंत्री के सबसे खास और पूर्व डिप्टी सीएम मनीष सिसोदिया जेल में बंद हैं.\xa0', ""ये भी पढ़ें-Uddhav vs Shinde: 'शिंदे कैंप के विधायकों को उद्धव ठाकरे के कांग्रेस-NCP से गठबंधन पर एतराज था तो...', सुप्रीम कोर्ट की अहम टिप्पणी"", 'क्या प्रधानमंत्री नरेंद्र मोदी को मिल सकता है शांति का नोबेल पुरस्कार?', 'Viral Video: टिकट चेकर और महिला यात्री के बीच स्टेशन पर हुई झड़प, वीडियो वायरल हुआ तो रेलवे ने किया सस्पेंड', 'Congress On Adani: ईडी दफ्तर में अडानी मामले की शिकायत करने से रोका गया तो मल्लिकार्जुन खरगे ने कर दिया ईमेल', 'Cheating Case: मुख्यमंत्री जगन मोहन रेड्डी का PA बनकर पूर्व रणजी क्रिकेटर ने कर ली लाखों की ठगी, अब चढ़ा पुलिस के हत्थे', ""Uddhav vs Shinde: 'शिंदे कैंप के विधायकों को उद्धव ठाकरे के कांग्रेस-NCP से गठबंधन पर एतराज था तो...', सुप्रीम कोर्ट की अहम टिप्पणी"", 'IPL\xa02023: ऋषभ पंत से लेकर जसप्रीत बुमराह तक, आगामी सीजन में ये बड़े खिलाड़ी नहीं दिखेंगे मैदान पर', 'सिलिकॉन वैली:  हिंदू-मुसलमान या फिर सिख, कोई भी हो अब हर युवा यहीं जाना चाहता है, जानिए क्यों?', 'Sonu Sood को ऑफर हुए राज्यसभा और डिप्टी सीएम बनने के पद, पॉलिटिक्स जॉइन करने के सवाल पर एक्टर ने किया खुलासा', 'Mobile Tariff: रिलायंस जियो के इस धमाकेदार नए पोस्ट-पेड टैरिफ प्लान ने बढ़ाई एयरटेल-वोडाफोन आइडिया की मुश्किल!', 'SCO Summit: एससीओ समिट के लिए भारत ने पाकिस्तान के रक्षा मंत्री को भेजा न्यौता, अगले महीने दिल्ली में होगी मीटिंग']"
